Name,Purpose
Gaines Inc,Secured clear-thinking monitoring for productize strategic eyeballs
James Inc,Inverse systemic focus group for embrace compelling architectures
Lopez-Carlson,Future-proofed 3rdgeneration encoding for monetize impactful technologies
Thompson-Perez,Universal interactive process improvement for expedite front-end vortals
Sanders LLC,Team-oriented full-range open architecture for strategize strategic architectures
Bonilla-Perez,Optimized tertiary strategy for seize innovative experiences
Martin Ltd,Integrated multi-tasking algorithm for implement virtual e-markets
Kelley Ltd,Enhanced full-range methodology for revolutionize robust paradigms
Hanson and Sons,Implemented well-modulated moratorium for synthesize 24/365 e-commerce
Giles-Hunter,Exclusive reciprocal matrix for envisioneer transparent web services
Rodriguez-Wells,Secured national definition for revolutionize frictionless mindshare
Lopez-Mueller,Integrated directional concept for synthesize virtual web services
"Davis, Holmes and Meza",Profit-focused heuristic strategy for iterate open-source architectures
"Stephens, Welch and Robinson",Programmable mission-critical service-desk for utilize 24/7 initiatives
Brennan Inc,Optimized non-volatile monitoring for revolutionize efficient communities
Walker-Taylor,Profit-focused fault-tolerant collaboration for e-enable collaborative paradigms
"Casey, Steele and Taylor",Inverse 5thgeneration model for streamline integrated e-markets
Taylor-Mathis,Synergized empowering alliance for evolve magnetic action-items
"Bruce, Diaz and Harrington",Diverse regional neural-net for drive magnetic e-services
"May, Gates and Carter",Re-engineered 6thgeneration migration for visualize best-of-breed web services
Velazquez and Sons,Networked reciprocal Local Area Network for extend best-of-breed bandwidth
"Williamson, Little and Thompson",Enhanced demand-driven contingency for extend vertical solutions
Patel Group,Assimilated uniform adapter for streamline cutting-edge e-business
"Smith, Davis and Williams",Vision-oriented systematic orchestration for generate leading-edge initiatives
Moore-Caldwell,Reverse-engineered uniform adapter for harness 24/7 channels
"Dickerson, Stevens and Lewis",Advanced background paradigm for visualize mission-critical vortals
"Medina, Nichols and Woods",Extended intermediate system engine for strategize customized methodologies
George LLC,Synchronized even-keeled monitoring for embrace back-end markets
Wells-Buck,Profound human-resource database for incentivize customized niches
"Jensen, Mitchell and Bean",Reactive multi-tasking standardization for aggregate real-time markets
Duncan Group,Profit-focused dynamic methodology for transform e-business experiences
"Russell, Whitaker and Gibson",Focused modular open architecture for exploit compelling synergies
Carter-Lynch,Public-key 24hour definition for optimize visionary channels
"Hood, Ross and Diaz",Cross-group context-sensitive Internet solution for deploy cross-platform portals
"Owens, Yu and Nelson",Visionary analyzing complexity for embrace front-end e-commerce
Banks-Walls,Total contextually-based function for innovate intuitive paradigms
"Gonzalez, Johnson and Wong",Cross-platform value-added hierarchy for engineer vertical mindshare
Martin-Griffin,Multi-lateral bandwidth-monitored migration for strategize integrated e-business
Clark PLC,Intuitive empowering parallelism for evolve virtual functionalities
Becker-Johnson,Open-source hybrid archive for scale collaborative channels
Dunn PLC,Networked grid-enabled extranet for transition clicks-and-mortar applications
Wyatt Ltd,Public-key grid-enabled concept for enhance enterprise e-commerce
Osborne-Flores,Proactive eco-centric matrix for redefine back-end relationships
"Gaines, Barber and Grimes",Organized cohesive data-warehouse for visualize B2B mindshare
Carlson Ltd,Business-focused directional function for optimize efficient convergence
"Hoffman, Green and Patel",Grass-roots upward-trending collaboration for harness frictionless experiences
Garcia LLC,Multi-tiered radical matrices for aggregate strategic initiatives
"Johnson, Wheeler and Simmons",Balanced bandwidth-monitored conglomeration for unleash collaborative architectures
"Shaw, Alvarez and Glass",Programmable local customer loyalty for streamline revolutionary action-items
"Mercado, Martinez and Abbott",Upgradable leadingedge application for maximize out-of-the-box convergence
